### ISSUE TITLE
tcpdump - bus error in your builds

### ISSUE THREAD

**Issue by asergiu** [gwlim/mips74k-lede-patch#24]
Hello Gwlim again
I have a problem with the builds images for ar71xx - the tcpdump app gives a Bus error and crashes every few seconds (1-5).  This might be due to the fastpath patch or maybe as seen on internet beucase of some compiler optimizations -O2 (sometimes).

I took the sources LEDE and you patch to try to see what could be the culprit but was not able to reproduce your image completely. Could you send your config generated after make menuconfig ?

Strange here is that tcpdump was downloaded from the lede repo.  And this happens all the times tcpdump is runned systematically

here is a short preview of the problem:

root@Tvarita:~# tcpdump -i br-lan
tcpdump: verbose output suppressed, use -v or -vv for full protocol decode
listening on br-lan, link-type EN10MB (Ethernet), capture size 262144 bytes
10:53:30.370261 IP 192.168.43.121.50769 > Tvarita.lan.22: Flags [.], ack 1224978878, win 2049, length 0
10:53:30.377748 IP 192.168.43.121.50769 > Tvarita.lan.22: Flags [.], ack 257, win 2048, length 0
10:53:30.397824 IP6 2a02:2f0e:1b0:1cb:71a4:540f:651d:4ab1.54897 > wn-in-xbd.1e100.net.443: UDP, length 23
10:53:30.417636 ARP, Request who-has 192.168.43.100 tell 192.168.43.211, length 46
10:53:30.438094 IP 192.168.43.121.50769 > Tvarita.lan.22: Flags [.], ack 401, win 2048, length 0
10:53:30.453192 IP 192.168.43.121.50769 > Tvarita.lan.22: Flags [.], ack 673, win 2053, length 0
10:53:30.454397 IP 192.168.43.121.50769 > Tvarita.lan.22: Flags [.], ack 961, win 2052, length 0
10:53:30.495535 IP 192.168.43.121.50769 > Tvarita.lan.22: Flags [.], ack 1105, win 2051, length 0
10:53:30.541636 IP 192.168.43.121.50769 > Tvarita.lan.22: Flags [.], ack 1249, win 2050, length 0
10:53:30.575901 IP 192.168.43.57.60279 > 239.255.255.250.1900: UDP, length 174
10:53:30.583302 IP 192.168.43.121.50769 > Tvarita.lan.22: Flags [.], ack 1521, win 2049, length 0
10:53:30.604197 IP 192.168.43.115.50393 > Tvarita.lan.80: Flags [.], ack 937882773, win 2053, length 0
10:53:30.604948 IP 192.168.43.115.50393 > Tvarita.lan.80: Flags [.], ack 111, win 2052, length 0
10:53:30.606403 IP 192.168.43.121.50769 > Tvarita.lan.22: Flags [.], ack 1905, win 2048, length 0
10:53:30.610095 IP C700.lan.47677 > bam-9.nr-data.net.443: Flags [.], seq 2078015572:2078015573, ack 3999418776, win 64140, length 1
10:53:30.617516 IP 192.168.43.121.50769 > Tvarita.lan.22: Flags [.], ack 2225, win 2053, length 0
10:53:30.658068 IP 192.168.43.115.50393 > Tvarita.lan.80: Flags [.], ack 116, win 2052, length 0
10:53:30.663028 IP 192.168.43.121.50769 > Tvarita.lan.22: Flags [.], ack 2513, win 2052, length 0
10:53:30.703076 IP 192.168.43.115.50393 > Tvarita.lan.80: Flags [.], ack 1402, win 2047, length 0
10:53:30.726282 IP 192.168.43.121.50751 > lb-192-30-253-112-iad.github.com.443: Flags [.], seq 1137594086:1137594087, ack 2222120889, win 258, length 1
10:53:30.741906 IP 192.168.43.121.50752 > 151.101.12.133.443: Flags [.], seq 3382169828:3382169829, ack 3046358220, win 254, length 1
Bus error

**Comment by gwlim** [comment]
It has already been fixed in the latest image.
https://github.com/gwlim/openwrt-sfe-flowoffload
```
+-#define cpu_has_mips16		0
++#define cpu_has_msa		0
++#define cpu_has_mips16		1
```

**Comment by asergiu** [comment]
Ok I will take a look ! Is there an image generated with this or I need to build one ?

**Comment by gwlim** [comment]
All the new mips images have already been fixed.
The code above was the fix, tcpdump crashed because mips16 was removed but upstream openwrt packages were compiled with mips16
